------[ Versions ]------

Program Version : AIDA64 Engineer v6.00.5169 Beta
BenchDLL Version: 4.5.811-x64
Windows Version : Microsoft Windows 10 Pro 10.0.18362.356 (64-bit)

------[ CPU Info ]------

CPU Type          : QuadCore Intel Core i7-1065G7, 1300 MHz (13 x 100)
CPU Alias         : Ice Lake-U
CPU Platform      : FCBGA1526
CPU Stepping      : D1
Instruction Set   : x86, x86-64, MMX, SSE, SSE2, SSE3, SSSE3, SSE4.1, SSE4.2, AVX, AVX2, AVX-512, FMA, AES, SHA
CPUID Manufacturer: GenuineIntel
CPUID CPU Name    : Intel(R) Core(TM) i7-1065G7 CPU @ 1.30GHz
CPUID Revision    : 000706E5h
IA Brand ID       : 00h  (Unknown)
Platform ID       : 40h  (FCBGA1526)
HTT / CMP Units   : 2 / 4
Max. NUMA Node    : 0

Tjmax Temperature          : 100 Celsius
HTC Temperature Limit      : 0 Celsius
CPU TDP                    : 15 W
CPU TDC                    : 129 A
CPU Max Power Limit        : Unlimited Power / Unlimited Time
CPU Power Limit 1 (Long)   : 28 W / 28.00 sec  (Unlocked)
CPU Power Limit 2 (Short)  : 51 W / 2.44 ms  (Unlocked)
Max Turbo Boost Multipliers: 1C: 39x, 2C: 38x, 3C: 35x, 4C: 35x

------[ Motherboard Info ]------

Motherboard ID      : <DMI>
Motherboard Model   : Lenovo Yoga C940-14IIL
Motherboard Chipset : Intel Ice Point-LP, Intel Ice Lake-U

DMI MB Manufacturer : LENOVO
DMI MB Product      : LNVNB161216
DMI MB Version      : NO DPK
DMI MB Serial       : PF1GGQWY
DMI SYS Manufacturer: LENOVO
DMI SYS Product     : 81Q9
DMI SYS Version     : Lenovo Yoga C940-14IIL
DMI SYS Serial      : PF1GGQWY
DMI BIOS Version    : AUCN40WW


------[ Logical CPU #0 ]------

allcpu: Package 0 / Core 0 / Thread 0: Valid

CPUID 00000000: 0000001B-756E6547-6C65746E-49656E69 [GenuineIntel]
CPUID 00000001: 000706E5-00100800-7FFAFBBF-BFEBFBFF
CPUID 00000002: 00FEFF01-000000F0-00000000-00000000
CPUID 00000003: 00000000-00000000-00000000-00000000
CPUID 00000004: 1C004121-02C0003F-0000003F-00000000 [SL 00] [L1D: 48 KB]
CPUID 00000004: 1C004122-01C0003F-0000003F-00000000 [SL 01] [L1I: 32 KB]
CPUID 00000004: 1C004143-01C0003F-000003FF-00000000 [SL 02] [L2U: 512 KB]
CPUID 00000004: 1C03C163-03C0003F-00001FFF-00000006 [SL 03] [L3U: 8 MB]
CPUID 00000005: 00000040-00000040-00000003-11121020
CPUID 00000006: 0007AFF5-00000002-00000009-00000000
CPUID 00000007: 00000000-F2BF27EF-40405F4E-BC000410
CPUID 00000008: 00000000-00000000-00000000-00000000
CPUID 00000009: 00000000-00000000-00000000-00000000
CPUID 0000000A: 08300805-00000000-0000000F-00008604
CPUID 0000000B: 00000001-00000002-00000100-00000000 [SL 00]
CPUID 0000000B: 00000004-00000008-00000201-00000000 [SL 01]
CPUID 0000000C: 00000000-00000000-00000000-00000000
CPUID 0000000D: 000002E7-00000A80-00000A88-00000000 [SL 00] [x87]
CPUID 0000000D: 0000000F-00000A00-00002100-00000000 [SL 01] [SSE]
CPUID 0000000D: 00000100-00000240-00000000-00000000 [SL 02] [AVX]
CPUID 0000000D: 00000040-00000440-00000000-00000000 [SL 05] [AVX-512 Opmask]
CPUID 0000000D: 00000200-00000480-00000000-00000000 [SL 06] [AVX-512 Hi256]
CPUID 0000000D: 00000400-00000680-00000000-00000000 [SL 07] [AVX-512 Hi16]
CPUID 0000000D: 00000080-00000000-00000001-00000000 [SL 08] [PT]
CPUID 0000000D: 00000008-00000A80-00000000-00000000 [SL 09] [PKRU]
CPUID 0000000D: 00000008-00000000-00000001-00000000 [SL 0D]
CPUID 0000000E: 00000000-00000000-00000000-00000000
CPUID 0000000F: 00000000-00000000-00000000-00000000 [SL 00]
CPUID 0000000F: 00000000-00000000-00000000-00000000 [SL 01]
CPUID 00000010: 00000000-00000000-00000000-00000000 [SL 00]
CPUID 00000010: 00000000-00000000-00000000-00000000 [SL 01]
CPUID 00000011: 00000000-00000000-00000000-00000000
CPUID 00000012: 00000063-00000001-00000000-00002F1F [SL 00]
CPUID 00000012: 000000B6-00000000-000002E7-00000000 [SL 01]
CPUID 00000012: 30180001-00000000-0BC00001-00000000 [SL 02]
CPUID 00000013: 00000000-00000000-00000000-00000000
CPUID 00000014: 00000001-0000000F-00000007-00000000 [SL 00]
CPUID 00000014: 02490002-003F1FFF-00000000-00000000 [SL 01]
CPUID 00000015: 00000002-0000004E-0249F000-00000000 [39.00x / 38400000]
CPUID 00000016: 000005DC-00000F3C-00000064-00000000 [1500 / 3900 / 100]
CPUID 00000017: 00000000-00000000-00000000-00000000 [SL 00]
CPUID 00000018: 00000007-00000000-00000000-00000000 [SL 00]
CPUID 00000018: 00000000-00080007-00000001-00004122 [SL 01]
CPUID 00000018: 00000000-0010000F-00000001-00004125 [SL 02]
CPUID 00000018: 00000000-00040001-00000010-00004024 [SL 03]
CPUID 00000018: 00000000-00040006-00000008-00004024 [SL 04]
CPUID 00000018: 00000000-00080008-00000001-00004124 [SL 05]
CPUID 00000018: 00000000-00080007-00000080-00004043 [SL 06]
CPUID 00000018: 00000000-00080009-00000080-00004043 [SL 07]
CPUID 00000019: 00000000-00000000-00000000-00000000
CPUID 0000001A: 00000000-00000000-00000000-00000000
CPUID 0000001B: 00000000-00000000-00000000-00000000
CPUID 80000000: 80000008-00000000-00000000-00000000
CPUID 80000001: 00000000-00000000-00000121-2C100000
CPUID 80000002: 65746E49-2952286C-726F4320-4D542865 [Intel(R) Core(TM]
CPUID 80000003: 37692029-3630312D-20374735-20555043 [) i7-1065G7 CPU ]
CPUID 80000004: 2E312040-48473033-0000007A-00000000 [@ 1.30GHz]
CPUID 80000005: 00000000-00000000-00000000-00000000 [L1D: 0 KB / L1I: 0 KB]
CPUID 80000006: 00000000-00000000-01006040-00000000 [L2: 256 KB] / L3: 0 KB]
CPUID 80000007: 00000000-00000000-00000000-00000100
CPUID 80000008: 00003027-00000000-00000000-00000000

L1    Data Cache:    48 KB, 12-way Associative, 64-byte Line
L1  Instr. Cache:    32 KB,  8-way Associative, 64-byte Line
L2 Unified Cache:   512 KB,  8-way Associative, 64-byte Line
L3 Unified Cache:     8 MB, 16-way Associative, 64-byte Line

------[ Logical CPU #1 ]------

allcpu: Package 0 / Core 0 / Thread 1: Valid, Virtual

CPUID 00000000: 0000001B-756E6547-6C65746E-49656E69 [GenuineIntel]
CPUID 00000001: 000706E5-01100800-7FFAFBBF-BFEBFBFF
CPUID 00000002: 00FEFF01-000000F0-00000000-00000000
CPUID 00000003: 00000000-00000000-00000000-00000000
CPUID 00000004: 1C004121-02C0003F-0000003F-00000000 [SL 00] [L1D: 48 KB]
CPUID 00000004: 1C004122-01C0003F-0000003F-00000000 [SL 01] [L1I: 32 KB]
CPUID 00000004: 1C004143-01C0003F-000003FF-00000000 [SL 02] [L2U: 512 KB]
CPUID 00000004: 1C03C163-03C0003F-00001FFF-00000006 [SL 03] [L3U: 8 MB]
CPUID 00000005: 00000040-00000040-00000003-11121020
CPUID 00000006: 0007AFF5-00000002-00000009-00000000
CPUID 00000007: 00000000-F2BF27EF-40405F4E-BC000410
CPUID 00000008: 00000000-00000000-00000000-00000000
CPUID 00000009: 00000000-00000000-00000000-00000000
CPUID 0000000A: 08300805-00000000-0000000F-00008604
CPUID 0000000B: 00000001-00000002-00000100-00000001 [SL 00]
CPUID 0000000B: 00000004-00000008-00000201-00000001 [SL 01]
CPUID 0000000C: 00000000-00000000-00000000-00000000
CPUID 0000000D: 000002E7-00000A80-00000A88-00000000 [SL 00] [x87]
CPUID 0000000D: 0000000F-00000A00-00002100-00000000 [SL 01] [SSE]
CPUID 0000000D: 00000100-00000240-00000000-00000000 [SL 02] [AVX]
CPUID 0000000D: 00000040-00000440-00000000-00000000 [SL 05] [AVX-512 Opmask]
CPUID 0000000D: 00000200-00000480-00000000-00000000 [SL 06] [AVX-512 Hi256]
CPUID 0000000D: 00000400-00000680-00000000-00000000 [SL 07] [AVX-512 Hi16]
CPUID 0000000D: 00000080-00000000-00000001-00000000 [SL 08] [PT]
CPUID 0000000D: 00000008-00000A80-00000000-00000000 [SL 09] [PKRU]
CPUID 0000000D: 00000008-00000000-00000001-00000000 [SL 0D]
CPUID 0000000E: 00000000-00000000-00000000-00000000
CPUID 0000000F: 00000000-00000000-00000000-00000000 [SL 00]
CPUID 0000000F: 00000000-00000000-00000000-00000000 [SL 01]
CPUID 00000010: 00000000-00000000-00000000-00000000 [SL 00]
CPUID 00000010: 00000000-00000000-00000000-00000000 [SL 01]
CPUID 00000011: 00000000-00000000-00000000-00000000
CPUID 00000012: 00000063-00000001-00000000-00002F1F [SL 00]
CPUID 00000012: 000000B6-00000000-000002E7-00000000 [SL 01]
CPUID 00000012: 30180001-00000000-0BC00001-00000000 [SL 02]
CPUID 00000013: 00000000-00000000-00000000-00000000
CPUID 00000014: 00000001-0000000F-00000007-00000000 [SL 00]
CPUID 00000014: 02490002-003F1FFF-00000000-00000000 [SL 01]
CPUID 00000015: 00000002-0000004E-0249F000-00000000 [39.00x / 38400000]
CPUID 00000016: 000005DC-00000F3C-00000064-00000000 [1500 / 3900 / 100]
CPUID 00000017: 00000000-00000000-00000000-00000000 [SL 00]
CPUID 00000018: 00000007-00000000-00000000-00000000 [SL 00]
CPUID 00000018: 00000000-00080007-00000001-00004122 [SL 01]
CPUID 00000018: 00000000-0010000F-00000001-00004125 [SL 02]
CPUID 00000018: 00000000-00040001-00000010-00004024 [SL 03]
CPUID 00000018: 00000000-00040006-00000008-00004024 [SL 04]
CPUID 00000018: 00000000-00080008-00000001-00004124 [SL 05]
CPUID 00000018: 00000000-00080007-00000080-00004043 [SL 06]
CPUID 00000018: 00000000-00080009-00000080-00004043 [SL 07]
CPUID 00000019: 00000000-00000000-00000000-00000000
CPUID 0000001A: 00000000-00000000-00000000-00000000
CPUID 0000001B: 00000000-00000000-00000000-00000000
CPUID 80000000: 80000008-00000000-00000000-00000000
CPUID 80000001: 00000000-00000000-00000121-2C100000
CPUID 80000002: 65746E49-2952286C-726F4320-4D542865 [Intel(R) Core(TM]
CPUID 80000003: 37692029-3630312D-20374735-20555043 [) i7-1065G7 CPU ]
CPUID 80000004: 2E312040-48473033-0000007A-00000000 [@ 1.30GHz]
CPUID 80000005: 00000000-00000000-00000000-00000000 [L1D: 0 KB / L1I: 0 KB]
CPUID 80000006: 00000000-00000000-01006040-00000000 [L2: 256 KB] / L3: 0 KB]
CPUID 80000007: 00000000-00000000-00000000-00000100
CPUID 80000008: 00003027-00000000-00000000-00000000

L1    Data Cache:    48 KB, 12-way Associative, 64-byte Line
L1  Instr. Cache:    32 KB,  8-way Associative, 64-byte Line
L2 Unified Cache:   512 KB,  8-way Associative, 64-byte Line
L3 Unified Cache:     8 MB, 16-way Associative, 64-byte Line

------[ Logical CPU #2 ]------

allcpu: Package 0 / Core 1 / Thread 0: Valid

CPUID 00000000: 0000001B-756E6547-6C65746E-49656E69 [GenuineIntel]
CPUID 00000001: 000706E5-02100800-7FFAFBBF-BFEBFBFF
CPUID 00000002: 00FEFF01-000000F0-00000000-00000000
CPUID 00000003: 00000000-00000000-00000000-00000000
CPUID 00000004: 1C004121-02C0003F-0000003F-00000000 [SL 00] [L1D: 48 KB]
CPUID 00000004: 1C004122-01C0003F-0000003F-00000000 [SL 01] [L1I: 32 KB]
CPUID 00000004: 1C004143-01C0003F-000003FF-00000000 [SL 02] [L2U: 512 KB]
CPUID 00000004: 1C03C163-03C0003F-00001FFF-00000006 [SL 03] [L3U: 8 MB]
CPUID 00000005: 00000040-00000040-00000003-11121020
CPUID 00000006: 0007AFF5-00000002-00000009-00000000
CPUID 00000007: 00000000-F2BF27EF-40405F4E-BC000410
CPUID 00000008: 00000000-00000000-00000000-00000000
CPUID 00000009: 00000000-00000000-00000000-00000000
CPUID 0000000A: 08300805-00000000-0000000F-00008604
CPUID 0000000B: 00000001-00000002-00000100-00000002 [SL 00]
CPUID 0000000B: 00000004-00000008-00000201-00000002 [SL 01]
CPUID 0000000C: 00000000-00000000-00000000-00000000
CPUID 0000000D: 000002E7-00000A80-00000A88-00000000 [SL 00] [x87]
CPUID 0000000D: 0000000F-00000A00-00002100-00000000 [SL 01] [SSE]
CPUID 0000000D: 00000100-00000240-00000000-00000000 [SL 02] [AVX]
CPUID 0000000D: 00000040-00000440-00000000-00000000 [SL 05] [AVX-512 Opmask]
CPUID 0000000D: 00000200-00000480-00000000-00000000 [SL 06] [AVX-512 Hi256]
CPUID 0000000D: 00000400-00000680-00000000-00000000 [SL 07] [AVX-512 Hi16]
CPUID 0000000D: 00000080-00000000-00000001-00000000 [SL 08] [PT]
CPUID 0000000D: 00000008-00000A80-00000000-00000000 [SL 09] [PKRU]
CPUID 0000000D: 00000008-00000000-00000001-00000000 [SL 0D]
CPUID 0000000E: 00000000-00000000-00000000-00000000
CPUID 0000000F: 00000000-00000000-00000000-00000000 [SL 00]
CPUID 0000000F: 00000000-00000000-00000000-00000000 [SL 01]
CPUID 00000010: 00000000-00000000-00000000-00000000 [SL 00]
CPUID 00000010: 00000000-00000000-00000000-00000000 [SL 01]
CPUID 00000011: 00000000-00000000-00000000-00000000
CPUID 00000012: 00000063-00000001-00000000-00002F1F [SL 00]
CPUID 00000012: 000000B6-00000000-000002E7-00000000 [SL 01]
CPUID 00000012: 30180001-00000000-0BC00001-00000000 [SL 02]
CPUID 00000013: 00000000-00000000-00000000-00000000
CPUID 00000014: 00000001-0000000F-00000007-00000000 [SL 00]
CPUID 00000014: 02490002-003F1FFF-00000000-00000000 [SL 01]
CPUID 00000015: 00000002-0000004E-0249F000-00000000 [39.00x / 38400000]
CPUID 00000016: 000005DC-00000F3C-00000064-00000000 [1500 / 3900 / 100]
CPUID 00000017: 00000000-00000000-00000000-00000000 [SL 00]
CPUID 00000018: 00000007-00000000-00000000-00000000 [SL 00]
CPUID 00000018: 00000000-00080007-00000001-00004122 [SL 01]
CPUID 00000018: 00000000-0010000F-00000001-00004125 [SL 02]
CPUID 00000018: 00000000-00040001-00000010-00004024 [SL 03]
CPUID 00000018: 00000000-00040006-00000008-00004024 [SL 04]
CPUID 00000018: 00000000-00080008-00000001-00004124 [SL 05]
CPUID 00000018: 00000000-00080007-00000080-00004043 [SL 06]
CPUID 00000018: 00000000-00080009-00000080-00004043 [SL 07]
CPUID 00000019: 00000000-00000000-00000000-00000000
CPUID 0000001A: 00000000-00000000-00000000-00000000
CPUID 0000001B: 00000000-00000000-00000000-00000000
CPUID 80000000: 80000008-00000000-00000000-00000000
CPUID 80000001: 00000000-00000000-00000121-2C100000
CPUID 80000002: 65746E49-2952286C-726F4320-4D542865 [Intel(R) Core(TM]
CPUID 80000003: 37692029-3630312D-20374735-20555043 [) i7-1065G7 CPU ]
CPUID 80000004: 2E312040-48473033-0000007A-00000000 [@ 1.30GHz]
CPUID 80000005: 00000000-00000000-00000000-00000000 [L1D: 0 KB / L1I: 0 KB]
CPUID 80000006: 00000000-00000000-01006040-00000000 [L2: 256 KB] / L3: 0 KB]
CPUID 80000007: 00000000-00000000-00000000-00000100
CPUID 80000008: 00003027-00000000-00000000-00000000

L1    Data Cache:    48 KB, 12-way Associative, 64-byte Line
L1  Instr. Cache:    32 KB,  8-way Associative, 64-byte Line
L2 Unified Cache:   512 KB,  8-way Associative, 64-byte Line
L3 Unified Cache:     8 MB, 16-way Associative, 64-byte Line

------[ Logical CPU #3 ]------

allcpu: Package 0 / Core 1 / Thread 1: Valid, Virtual

CPUID 00000000: 0000001B-756E6547-6C65746E-49656E69 [GenuineIntel]
CPUID 00000001: 000706E5-03100800-7FFAFBBF-BFEBFBFF
CPUID 00000002: 00FEFF01-000000F0-00000000-00000000
CPUID 00000003: 00000000-00000000-00000000-00000000
CPUID 00000004: 1C004121-02C0003F-0000003F-00000000 [SL 00] [L1D: 48 KB]
CPUID 00000004: 1C004122-01C0003F-0000003F-00000000 [SL 01] [L1I: 32 KB]
CPUID 00000004: 1C004143-01C0003F-000003FF-00000000 [SL 02] [L2U: 512 KB]
CPUID 00000004: 1C03C163-03C0003F-00001FFF-00000006 [SL 03] [L3U: 8 MB]
CPUID 00000005: 00000040-00000040-00000003-11121020
CPUID 00000006: 0007AFF5-00000002-00000009-00000000
CPUID 00000007: 00000000-F2BF27EF-40405F4E-BC000410
CPUID 00000008: 00000000-00000000-00000000-00000000
CPUID 00000009: 00000000-00000000-00000000-00000000
CPUID 0000000A: 08300805-00000000-0000000F-00008604
CPUID 0000000B: 00000001-00000002-00000100-00000003 [SL 00]
CPUID 0000000B: 00000004-00000008-00000201-00000003 [SL 01]
CPUID 0000000C: 00000000-00000000-00000000-00000000
CPUID 0000000D: 000002E7-00000A80-00000A88-00000000 [SL 00] [x87]
CPUID 0000000D: 0000000F-00000A00-00002100-00000000 [SL 01] [SSE]
CPUID 0000000D: 00000100-00000240-00000000-00000000 [SL 02] [AVX]
CPUID 0000000D: 00000040-00000440-00000000-00000000 [SL 05] [AVX-512 Opmask]
CPUID 0000000D: 00000200-00000480-00000000-00000000 [SL 06] [AVX-512 Hi256]
CPUID 0000000D: 00000400-00000680-00000000-00000000 [SL 07] [AVX-512 Hi16]
CPUID 0000000D: 00000080-00000000-00000001-00000000 [SL 08] [PT]
CPUID 0000000D: 00000008-00000A80-00000000-00000000 [SL 09] [PKRU]
CPUID 0000000D: 00000008-00000000-00000001-00000000 [SL 0D]
CPUID 0000000E: 00000000-00000000-00000000-00000000
CPUID 0000000F: 00000000-00000000-00000000-00000000 [SL 00]
CPUID 0000000F: 00000000-00000000-00000000-00000000 [SL 01]
CPUID 00000010: 00000000-00000000-00000000-00000000 [SL 00]
CPUID 00000010: 00000000-00000000-00000000-00000000 [SL 01]
CPUID 00000011: 00000000-00000000-00000000-00000000
CPUID 00000012: 00000063-00000001-00000000-00002F1F [SL 00]
CPUID 00000012: 000000B6-00000000-000002E7-00000000 [SL 01]
CPUID 00000012: 30180001-00000000-0BC00001-00000000 [SL 02]
CPUID 00000013: 00000000-00000000-00000000-00000000
CPUID 00000014: 00000001-0000000F-00000007-00000000 [SL 00]
CPUID 00000014: 02490002-003F1FFF-00000000-00000000 [SL 01]
CPUID 00000015: 00000002-0000004E-0249F000-00000000 [39.00x / 38400000]
CPUID 00000016: 000005DC-00000F3C-00000064-00000000 [1500 / 3900 / 100]
CPUID 00000017: 00000000-00000000-00000000-00000000 [SL 00]
CPUID 00000018: 00000007-00000000-00000000-00000000 [SL 00]
CPUID 00000018: 00000000-00080007-00000001-00004122 [SL 01]
CPUID 00000018: 00000000-0010000F-00000001-00004125 [SL 02]
CPUID 00000018: 00000000-00040001-00000010-00004024 [SL 03]
CPUID 00000018: 00000000-00040006-00000008-00004024 [SL 04]
CPUID 00000018: 00000000-00080008-00000001-00004124 [SL 05]
CPUID 00000018: 00000000-00080007-00000080-00004043 [SL 06]
CPUID 00000018: 00000000-00080009-00000080-00004043 [SL 07]
CPUID 00000019: 00000000-00000000-00000000-00000000
CPUID 0000001A: 00000000-00000000-00000000-00000000
CPUID 0000001B: 00000000-00000000-00000000-00000000
CPUID 80000000: 80000008-00000000-00000000-00000000
CPUID 80000001: 00000000-00000000-00000121-2C100000
CPUID 80000002: 65746E49-2952286C-726F4320-4D542865 [Intel(R) Core(TM]
CPUID 80000003: 37692029-3630312D-20374735-20555043 [) i7-1065G7 CPU ]
CPUID 80000004: 2E312040-48473033-0000007A-00000000 [@ 1.30GHz]
CPUID 80000005: 00000000-00000000-00000000-00000000 [L1D: 0 KB / L1I: 0 KB]
CPUID 80000006: 00000000-00000000-01006040-00000000 [L2: 256 KB] / L3: 0 KB]
CPUID 80000007: 00000000-00000000-00000000-00000100
CPUID 80000008: 00003027-00000000-00000000-00000000

L1    Data Cache:    48 KB, 12-way Associative, 64-byte Line
L1  Instr. Cache:    32 KB,  8-way Associative, 64-byte Line
L2 Unified Cache:   512 KB,  8-way Associative, 64-byte Line
L3 Unified Cache:     8 MB, 16-way Associative, 64-byte Line

------[ Logical CPU #4 ]------

allcpu: Package 0 / Core 2 / Thread 0: Valid

CPUID 00000000: 0000001B-756E6547-6C65746E-49656E69 [GenuineIntel]
CPUID 00000001: 000706E5-04100800-7FFAFBBF-BFEBFBFF
CPUID 00000002: 00FEFF01-000000F0-00000000-00000000
CPUID 00000003: 00000000-00000000-00000000-00000000
CPUID 00000004: 1C004121-02C0003F-0000003F-00000000 [SL 00] [L1D: 48 KB]
CPUID 00000004: 1C004122-01C0003F-0000003F-00000000 [SL 01] [L1I: 32 KB]
CPUID 00000004: 1C004143-01C0003F-000003FF-00000000 [SL 02] [L2U: 512 KB]
CPUID 00000004: 1C03C163-03C0003F-00001FFF-00000006 [SL 03] [L3U: 8 MB]
CPUID 00000005: 00000040-00000040-00000003-11121020
CPUID 00000006: 0007AFF5-00000002-00000009-00000000
CPUID 00000007: 00000000-F2BF27EF-40405F4E-BC000410
CPUID 00000008: 00000000-00000000-00000000-00000000
CPUID 00000009: 00000000-00000000-00000000-00000000
CPUID 0000000A: 08300805-00000000-0000000F-00008604
CPUID 0000000B: 00000001-00000002-00000100-00000004 [SL 00]
CPUID 0000000B: 00000004-00000008-00000201-00000004 [SL 01]
CPUID 0000000C: 00000000-00000000-00000000-00000000
CPUID 0000000D: 000002E7-00000A80-00000A88-00000000 [SL 00] [x87]
CPUID 0000000D: 0000000F-00000A00-00002100-00000000 [SL 01] [SSE]
CPUID 0000000D: 00000100-00000240-00000000-00000000 [SL 02] [AVX]
CPUID 0000000D: 00000040-00000440-00000000-00000000 [SL 05] [AVX-512 Opmask]
CPUID 0000000D: 00000200-00000480-00000000-00000000 [SL 06] [AVX-512 Hi256]
CPUID 0000000D: 00000400-00000680-00000000-00000000 [SL 07] [AVX-512 Hi16]
CPUID 0000000D: 00000080-00000000-00000001-00000000 [SL 08] [PT]
CPUID 0000000D: 00000008-00000A80-00000000-00000000 [SL 09] [PKRU]
CPUID 0000000D: 00000008-00000000-00000001-00000000 [SL 0D]
CPUID 0000000E: 00000000-00000000-00000000-00000000
CPUID 0000000F: 00000000-00000000-00000000-00000000 [SL 00]
CPUID 0000000F: 00000000-00000000-00000000-00000000 [SL 01]
CPUID 00000010: 00000000-00000000-00000000-00000000 [SL 00]
CPUID 00000010: 00000000-00000000-00000000-00000000 [SL 01]
CPUID 00000011: 00000000-00000000-00000000-00000000
CPUID 00000012: 00000063-00000001-00000000-00002F1F [SL 00]
CPUID 00000012: 000000B6-00000000-000002E7-00000000 [SL 01]
CPUID 00000012: 30180001-00000000-0BC00001-00000000 [SL 02]
CPUID 00000013: 00000000-00000000-00000000-00000000
CPUID 00000014: 00000001-0000000F-00000007-00000000 [SL 00]
CPUID 00000014: 02490002-003F1FFF-00000000-00000000 [SL 01]
CPUID 00000015: 00000002-0000004E-0249F000-00000000 [39.00x / 38400000]
CPUID 00000016: 000005DC-00000F3C-00000064-00000000 [1500 / 3900 / 100]
CPUID 00000017: 00000000-00000000-00000000-00000000 [SL 00]
CPUID 00000018: 00000007-00000000-00000000-00000000 [SL 00]
CPUID 00000018: 00000000-00080007-00000001-00004122 [SL 01]
CPUID 00000018: 00000000-0010000F-00000001-00004125 [SL 02]
CPUID 00000018: 00000000-00040001-00000010-00004024 [SL 03]
CPUID 00000018: 00000000-00040006-00000008-00004024 [SL 04]
CPUID 00000018: 00000000-00080008-00000001-00004124 [SL 05]
CPUID 00000018: 00000000-00080007-00000080-00004043 [SL 06]
CPUID 00000018: 00000000-00080009-00000080-00004043 [SL 07]
CPUID 00000019: 00000000-00000000-00000000-00000000
CPUID 0000001A: 00000000-00000000-00000000-00000000
CPUID 0000001B: 00000000-00000000-00000000-00000000
CPUID 80000000: 80000008-00000000-00000000-00000000
CPUID 80000001: 00000000-00000000-00000121-2C100000
CPUID 80000002: 65746E49-2952286C-726F4320-4D542865 [Intel(R) Core(TM]
CPUID 80000003: 37692029-3630312D-20374735-20555043 [) i7-1065G7 CPU ]
CPUID 80000004: 2E312040-48473033-0000007A-00000000 [@ 1.30GHz]
CPUID 80000005: 00000000-00000000-00000000-00000000 [L1D: 0 KB / L1I: 0 KB]
CPUID 80000006: 00000000-00000000-01006040-00000000 [L2: 256 KB] / L3: 0 KB]
CPUID 80000007: 00000000-00000000-00000000-00000100
CPUID 80000008: 00003027-00000000-00000000-00000000

L1    Data Cache:    48 KB, 12-way Associative, 64-byte Line
L1  Instr. Cache:    32 KB,  8-way Associative, 64-byte Line
L2 Unified Cache:   512 KB,  8-way Associative, 64-byte Line
L3 Unified Cache:     8 MB, 16-way Associative, 64-byte Line

------[ Logical CPU #5 ]------

allcpu: Package 0 / Core 2 / Thread 1: Valid, Virtual

CPUID 00000000: 0000001B-756E6547-6C65746E-49656E69 [GenuineIntel]
CPUID 00000001: 000706E5-05100800-7FFAFBBF-BFEBFBFF
CPUID 00000002: 00FEFF01-000000F0-00000000-00000000
CPUID 00000003: 00000000-00000000-00000000-00000000
CPUID 00000004: 1C004121-02C0003F-0000003F-00000000 [SL 00] [L1D: 48 KB]
CPUID 00000004: 1C004122-01C0003F-0000003F-00000000 [SL 01] [L1I: 32 KB]
CPUID 00000004: 1C004143-01C0003F-000003FF-00000000 [SL 02] [L2U: 512 KB]
CPUID 00000004: 1C03C163-03C0003F-00001FFF-00000006 [SL 03] [L3U: 8 MB]
CPUID 00000005: 00000040-00000040-00000003-11121020
CPUID 00000006: 0007AFF5-00000002-00000009-00000000
CPUID 00000007: 00000000-F2BF27EF-40405F4E-BC000410
CPUID 00000008: 00000000-00000000-00000000-00000000
CPUID 00000009: 00000000-00000000-00000000-00000000
CPUID 0000000A: 08300805-00000000-0000000F-00008604
CPUID 0000000B: 00000001-00000002-00000100-00000005 [SL 00]
CPUID 0000000B: 00000004-00000008-00000201-00000005 [SL 01]
CPUID 0000000C: 00000000-00000000-00000000-00000000
CPUID 0000000D: 000002E7-00000A80-00000A88-00000000 [SL 00] [x87]
CPUID 0000000D: 0000000F-00000A00-00002100-00000000 [SL 01] [SSE]
CPUID 0000000D: 00000100-00000240-00000000-00000000 [SL 02] [AVX]
CPUID 0000000D: 00000040-00000440-00000000-00000000 [SL 05] [AVX-512 Opmask]
CPUID 0000000D: 00000200-00000480-00000000-00000000 [SL 06] [AVX-512 Hi256]
CPUID 0000000D: 00000400-00000680-00000000-00000000 [SL 07] [AVX-512 Hi16]
CPUID 0000000D: 00000080-00000000-00000001-00000000 [SL 08] [PT]
CPUID 0000000D: 00000008-00000A80-00000000-00000000 [SL 09] [PKRU]
CPUID 0000000D: 00000008-00000000-00000001-00000000 [SL 0D]
CPUID 0000000E: 00000000-00000000-00000000-00000000
CPUID 0000000F: 00000000-00000000-00000000-00000000 [SL 00]
CPUID 0000000F: 00000000-00000000-00000000-00000000 [SL 01]
CPUID 00000010: 00000000-00000000-00000000-00000000 [SL 00]
CPUID 00000010: 00000000-00000000-00000000-00000000 [SL 01]
CPUID 00000011: 00000000-00000000-00000000-00000000
CPUID 00000012: 00000063-00000001-00000000-00002F1F [SL 00]
CPUID 00000012: 000000B6-00000000-000002E7-00000000 [SL 01]
CPUID 00000012: 30180001-00000000-0BC00001-00000000 [SL 02]
CPUID 00000013: 00000000-00000000-00000000-00000000
CPUID 00000014: 00000001-0000000F-00000007-00000000 [SL 00]
CPUID 00000014: 02490002-003F1FFF-00000000-00000000 [SL 01]
CPUID 00000015: 00000002-0000004E-0249F000-00000000 [39.00x / 38400000]
CPUID 00000016: 000005DC-00000F3C-00000064-00000000 [1500 / 3900 / 100]
CPUID 00000017: 00000000-00000000-00000000-00000000 [SL 00]
CPUID 00000018: 00000007-00000000-00000000-00000000 [SL 00]
CPUID 00000018: 00000000-00080007-00000001-00004122 [SL 01]
CPUID 00000018: 00000000-0010000F-00000001-00004125 [SL 02]
CPUID 00000018: 00000000-00040001-00000010-00004024 [SL 03]
CPUID 00000018: 00000000-00040006-00000008-00004024 [SL 04]
CPUID 00000018: 00000000-00080008-00000001-00004124 [SL 05]
CPUID 00000018: 00000000-00080007-00000080-00004043 [SL 06]
CPUID 00000018: 00000000-00080009-00000080-00004043 [SL 07]
CPUID 00000019: 00000000-00000000-00000000-00000000
CPUID 0000001A: 00000000-00000000-00000000-00000000
CPUID 0000001B: 00000000-00000000-00000000-00000000
CPUID 80000000: 80000008-00000000-00000000-00000000
CPUID 80000001: 00000000-00000000-00000121-2C100000
CPUID 80000002: 65746E49-2952286C-726F4320-4D542865 [Intel(R) Core(TM]
CPUID 80000003: 37692029-3630312D-20374735-20555043 [) i7-1065G7 CPU ]
CPUID 80000004: 2E312040-48473033-0000007A-00000000 [@ 1.30GHz]
CPUID 80000005: 00000000-00000000-00000000-00000000 [L1D: 0 KB / L1I: 0 KB]
CPUID 80000006: 00000000-00000000-01006040-00000000 [L2: 256 KB] / L3: 0 KB]
CPUID 80000007: 00000000-00000000-00000000-00000100
CPUID 80000008: 00003027-00000000-00000000-00000000

L1    Data Cache:    48 KB, 12-way Associative, 64-byte Line
L1  Instr. Cache:    32 KB,  8-way Associative, 64-byte Line
L2 Unified Cache:   512 KB,  8-way Associative, 64-byte Line
L3 Unified Cache:     8 MB, 16-way Associative, 64-byte Line

------[ Logical CPU #6 ]------

allcpu: Package 0 / Core 3 / Thread 0: Valid

CPUID 00000000: 0000001B-756E6547-6C65746E-49656E69 [GenuineIntel]
CPUID 00000001: 000706E5-06100800-7FFAFBBF-BFEBFBFF
CPUID 00000002: 00FEFF01-000000F0-00000000-00000000
CPUID 00000003: 00000000-00000000-00000000-00000000
CPUID 00000004: 1C004121-02C0003F-0000003F-00000000 [SL 00] [L1D: 48 KB]
CPUID 00000004: 1C004122-01C0003F-0000003F-00000000 [SL 01] [L1I: 32 KB]
CPUID 00000004: 1C004143-01C0003F-000003FF-00000000 [SL 02] [L2U: 512 KB]
CPUID 00000004: 1C03C163-03C0003F-00001FFF-00000006 [SL 03] [L3U: 8 MB]
CPUID 00000005: 00000040-00000040-00000003-11121020
CPUID 00000006: 0007AFF5-00000002-00000009-00000000
CPUID 00000007: 00000000-F2BF27EF-40405F4E-BC000410
CPUID 00000008: 00000000-00000000-00000000-00000000
CPUID 00000009: 00000000-00000000-00000000-00000000
CPUID 0000000A: 08300805-00000000-0000000F-00008604
CPUID 0000000B: 00000001-00000002-00000100-00000006 [SL 00]
CPUID 0000000B: 00000004-00000008-00000201-00000006 [SL 01]
CPUID 0000000C: 00000000-00000000-00000000-00000000
CPUID 0000000D: 000002E7-00000A80-00000A88-00000000 [SL 00] [x87]
CPUID 0000000D: 0000000F-00000A00-00002100-00000000 [SL 01] [SSE]
CPUID 0000000D: 00000100-00000240-00000000-00000000 [SL 02] [AVX]
CPUID 0000000D: 00000040-00000440-00000000-00000000 [SL 05] [AVX-512 Opmask]
CPUID 0000000D: 00000200-00000480-00000000-00000000 [SL 06] [AVX-512 Hi256]
CPUID 0000000D: 00000400-00000680-00000000-00000000 [SL 07] [AVX-512 Hi16]
CPUID 0000000D: 00000080-00000000-00000001-00000000 [SL 08] [PT]
CPUID 0000000D: 00000008-00000A80-00000000-00000000 [SL 09] [PKRU]
CPUID 0000000D: 00000008-00000000-00000001-00000000 [SL 0D]
CPUID 0000000E: 00000000-00000000-00000000-00000000
CPUID 0000000F: 00000000-00000000-00000000-00000000 [SL 00]
CPUID 0000000F: 00000000-00000000-00000000-00000000 [SL 01]
CPUID 00000010: 00000000-00000000-00000000-00000000 [SL 00]
CPUID 00000010: 00000000-00000000-00000000-00000000 [SL 01]
CPUID 00000011: 00000000-00000000-00000000-00000000
CPUID 00000012: 00000063-00000001-00000000-00002F1F [SL 00]
CPUID 00000012: 000000B6-00000000-000002E7-00000000 [SL 01]
CPUID 00000012: 30180001-00000000-0BC00001-00000000 [SL 02]
CPUID 00000013: 00000000-00000000-00000000-00000000
CPUID 00000014: 00000001-0000000F-00000007-00000000 [SL 00]
CPUID 00000014: 02490002-003F1FFF-00000000-00000000 [SL 01]
CPUID 00000015: 00000002-0000004E-0249F000-00000000 [39.00x / 38400000]
CPUID 00000016: 000005DC-00000F3C-00000064-00000000 [1500 / 3900 / 100]
CPUID 00000017: 00000000-00000000-00000000-00000000 [SL 00]
CPUID 00000018: 00000007-00000000-00000000-00000000 [SL 00]
CPUID 00000018: 00000000-00080007-00000001-00004122 [SL 01]
CPUID 00000018: 00000000-0010000F-00000001-00004125 [SL 02]
CPUID 00000018: 00000000-00040001-00000010-00004024 [SL 03]
CPUID 00000018: 00000000-00040006-00000008-00004024 [SL 04]
CPUID 00000018: 00000000-00080008-00000001-00004124 [SL 05]
CPUID 00000018: 00000000-00080007-00000080-00004043 [SL 06]
CPUID 00000018: 00000000-00080009-00000080-00004043 [SL 07]
CPUID 00000019: 00000000-00000000-00000000-00000000
CPUID 0000001A: 00000000-00000000-00000000-00000000
CPUID 0000001B: 00000000-00000000-00000000-00000000
CPUID 80000000: 80000008-00000000-00000000-00000000
CPUID 80000001: 00000000-00000000-00000121-2C100000
CPUID 80000002: 65746E49-2952286C-726F4320-4D542865 [Intel(R) Core(TM]
CPUID 80000003: 37692029-3630312D-20374735-20555043 [) i7-1065G7 CPU ]
CPUID 80000004: 2E312040-48473033-0000007A-00000000 [@ 1.30GHz]
CPUID 80000005: 00000000-00000000-00000000-00000000 [L1D: 0 KB / L1I: 0 KB]
CPUID 80000006: 00000000-00000000-01006040-00000000 [L2: 256 KB] / L3: 0 KB]
CPUID 80000007: 00000000-00000000-00000000-00000100
CPUID 80000008: 00003027-00000000-00000000-00000000

L1    Data Cache:    48 KB, 12-way Associative, 64-byte Line
L1  Instr. Cache:    32 KB,  8-way Associative, 64-byte Line
L2 Unified Cache:   512 KB,  8-way Associative, 64-byte Line
L3 Unified Cache:     8 MB, 16-way Associative, 64-byte Line

------[ Logical CPU #7 ]------

allcpu: Package 0 / Core 3 / Thread 1: Valid, Virtual

CPUID 00000000: 0000001B-756E6547-6C65746E-49656E69 [GenuineIntel]
CPUID 00000001: 000706E5-07100800-7FFAFBBF-BFEBFBFF
CPUID 00000002: 00FEFF01-000000F0-00000000-00000000
CPUID 00000003: 00000000-00000000-00000000-00000000
CPUID 00000004: 1C004121-02C0003F-0000003F-00000000 [SL 00] [L1D: 48 KB]
CPUID 00000004: 1C004122-01C0003F-0000003F-00000000 [SL 01] [L1I: 32 KB]
CPUID 00000004: 1C004143-01C0003F-000003FF-00000000 [SL 02] [L2U: 512 KB]
CPUID 00000004: 1C03C163-03C0003F-00001FFF-00000006 [SL 03] [L3U: 8 MB]
CPUID 00000005: 00000040-00000040-00000003-11121020
CPUID 00000006: 0007AFF5-00000002-00000009-00000000
CPUID 00000007: 00000000-F2BF27EF-40405F4E-BC000410
CPUID 00000008: 00000000-00000000-00000000-00000000
CPUID 00000009: 00000000-00000000-00000000-00000000
CPUID 0000000A: 08300805-00000000-0000000F-00008604
CPUID 0000000B: 00000001-00000002-00000100-00000007 [SL 00]
CPUID 0000000B: 00000004-00000008-00000201-00000007 [SL 01]
CPUID 0000000C: 00000000-00000000-00000000-00000000
CPUID 0000000D: 000002E7-00000A80-00000A88-00000000 [SL 00] [x87]
CPUID 0000000D: 0000000F-00000A00-00002100-00000000 [SL 01] [SSE]
CPUID 0000000D: 00000100-00000240-00000000-00000000 [SL 02] [AVX]
CPUID 0000000D: 00000040-00000440-00000000-00000000 [SL 05] [AVX-512 Opmask]
CPUID 0000000D: 00000200-00000480-00000000-00000000 [SL 06] [AVX-512 Hi256]
CPUID 0000000D: 00000400-00000680-00000000-00000000 [SL 07] [AVX-512 Hi16]
CPUID 0000000D: 00000080-00000000-00000001-00000000 [SL 08] [PT]
CPUID 0000000D: 00000008-00000A80-00000000-00000000 [SL 09] [PKRU]
CPUID 0000000D: 00000008-00000000-00000001-00000000 [SL 0D]
CPUID 0000000E: 00000000-00000000-00000000-00000000
CPUID 0000000F: 00000000-00000000-00000000-00000000 [SL 00]
CPUID 0000000F: 00000000-00000000-00000000-00000000 [SL 01]
CPUID 00000010: 00000000-00000000-00000000-00000000 [SL 00]
CPUID 00000010: 00000000-00000000-00000000-00000000 [SL 01]
CPUID 00000011: 00000000-00000000-00000000-00000000
CPUID 00000012: 00000063-00000001-00000000-00002F1F [SL 00]
CPUID 00000012: 000000B6-00000000-000002E7-00000000 [SL 01]
CPUID 00000012: 30180001-00000000-0BC00001-00000000 [SL 02]
CPUID 00000013: 00000000-00000000-00000000-00000000
CPUID 00000014: 00000001-0000000F-00000007-00000000 [SL 00]
CPUID 00000014: 02490002-003F1FFF-00000000-00000000 [SL 01]
CPUID 00000015: 00000002-0000004E-0249F000-00000000 [39.00x / 38400000]
CPUID 00000016: 000005DC-00000F3C-00000064-00000000 [1500 / 3900 / 100]
CPUID 00000017: 00000000-00000000-00000000-00000000 [SL 00]
CPUID 00000018: 00000007-00000000-00000000-00000000 [SL 00]
CPUID 00000018: 00000000-00080007-00000001-00004122 [SL 01]
CPUID 00000018: 00000000-0010000F-00000001-00004125 [SL 02]
CPUID 00000018: 00000000-00040001-00000010-00004024 [SL 03]
CPUID 00000018: 00000000-00040006-00000008-00004024 [SL 04]
CPUID 00000018: 00000000-00080008-00000001-00004124 [SL 05]
CPUID 00000018: 00000000-00080007-00000080-00004043 [SL 06]
CPUID 00000018: 00000000-00080009-00000080-00004043 [SL 07]
CPUID 00000019: 00000000-00000000-00000000-00000000
CPUID 0000001A: 00000000-00000000-00000000-00000000
CPUID 0000001B: 00000000-00000000-00000000-00000000
CPUID 80000000: 80000008-00000000-00000000-00000000
CPUID 80000001: 00000000-00000000-00000121-2C100000
CPUID 80000002: 65746E49-2952286C-726F4320-4D542865 [Intel(R) Core(TM]
CPUID 80000003: 37692029-3630312D-20374735-20555043 [) i7-1065G7 CPU ]
CPUID 80000004: 2E312040-48473033-0000007A-00000000 [@ 1.30GHz]
CPUID 80000005: 00000000-00000000-00000000-00000000 [L1D: 0 KB / L1I: 0 KB]
CPUID 80000006: 00000000-00000000-01006040-00000000 [L2: 256 KB] / L3: 0 KB]
CPUID 80000007: 00000000-00000000-00000000-00000100
CPUID 80000008: 00003027-00000000-00000000-00000000

L1    Data Cache:    48 KB, 12-way Associative, 64-byte Line
L1  Instr. Cache:    32 KB,  8-way Associative, 64-byte Line
L2 Unified Cache:   512 KB,  8-way Associative, 64-byte Line
L3 Unified Cache:     8 MB, 16-way Associative, 64-byte Line

------[ All CPUs ]------

CPU   0: APICID    0 / Package 0 / Core   0 / Thread 0: Valid
CPU   1: APICID    1 / Package 0 / Core   0 / Thread 1: Valid, Virtual
CPU   2: APICID    2 / Package 0 / Core   1 / Thread 0: Valid
CPU   3: APICID    3 / Package 0 / Core   1 / Thread 1: Valid, Virtual
CPU   4: APICID    4 / Package 0 / Core   2 / Thread 0: Valid
CPU   5: APICID    5 / Package 0 / Core   2 / Thread 1: Valid, Virtual
CPU   6: APICID    6 / Package 0 / Core   3 / Thread 0: Valid
CPU   7: APICID    7 / Package 0 / Core   3 / Thread 1: Valid, Virtual

------[ MSR Registers ]------

MSR 00000017: 001C-0000-0000-0000 [PlatID = 7]
MSR 0000001B: 0000-0000-FEE0-0900
MSR 00000035: 0000-0000-0004-0008
MSR 00000048: 0000-0000-0000-0001
MSR 00000049: < FAILED >
MSR 0000008B: 0000-002E-0000-0000
MSR 000000CE: 0004-043C-F181-0F00 [eD = 0]
MSR 000000E7: 0000-0095-ADF5-675F [S200]
MSR 000000E7: 0000-0095-B2A5-AE18 [S200]
MSR 000000E7: 0000-0095-B366-7C3D
MSR 000000E8: 0000-0080-9981-6363 [S200]
MSR 000000E8: 0000-0080-9A27-554E [S200]
MSR 000000E8: 0000-0080-9B0A-1BEF
MSR 0000010A: 0000-0000-0000-002B
MSR 0000010B: < FAILED >
MSR 00000194: 0000-0000-0001-0000
MSR 00000198: 0000-17EB-0000-0D00 [S200]
MSR 00000198: 0000-1800-0000-0D00 [S200]
MSR 00000198: 0000-1800-0000-0D00
MSR 00000199: 0000-0000-0000-0D00
MSR 0000019A: 0000-0000-0000-0000
MSR 0000019B: 0000-0000-0000-0010
MSR 0000019C: 0000-0000-8831-0A82 [S200]
MSR 0000019C: 0000-0000-8830-0A82 [S200]
MSR 0000019C: 0000-0000-8830-0A82
MSR 0000019D: 0000-0000-0000-0000
MSR 000001A0: 0000-0040-0085-0089
MSR 000001A2: 0000-0000-0564-0000
MSR 000001A4: 0000-0000-0000-0000
MSR 000001AA: 0000-0000-0040-1CC0
MSR 000001AC: < FAILED >
MSR 000001AD: 2323-2323-2323-2627
MSR 000001B0: 0000-0000-0000-0006
MSR 000001B1: 0000-0000-8830-0A82
MSR 000001B2: 0000-0000-0000-0000
MSR 000001FC: 0000-0000-0024-005D
MSR 00000300: < FAILED >
MSR 0000030A: 0000-0000-012A-1264 [S200]
MSR 0000030A: 0000-0000-012A-1264 [S200]
MSR 0000030A: 0000-0000-012A-1264
MSR 0000030B: 0000-0000-0158-1E73 [S200]
MSR 0000030B: 0000-0000-0158-1E73 [S200]
MSR 0000030B: 0000-0000-0158-1E73
MSR 00000480: 00DA-0500-0000-0013
MSR 00000481: 0000-00FF-0000-0016
MSR 00000482: FFF9-FFFE-0401-E172
MSR 00000483: 037F-FFFF-0003-6DFF
MSR 00000484: 0006-FFFF-0000-11FF
MSR 00000485: 0000-0000-7004-C1E7
MSR 00000486: 0000-0000-8000-0021
MSR 00000487: 0000-0000-FFFF-FFFF
MSR 00000488: 0000-0000-0000-2000
MSR 00000489: 0000-0000-0077-2FFF
MSR 0000048A: 0000-0000-0000-002E
MSR 0000048B: 335F-BFFF-0000-0000
MSR 0000048C: 0000-0F01-0673-4141
MSR 0000048D: 0000-00FF-0000-0016
MSR 0000048E: FFF9-FFFE-0400-6172
MSR 0000048F: 037F-FFFF-0003-6DFB
MSR 00000490: 0006-FFFF-0000-11FB
MSR 00000601: 0000-0000-0000-0408
MSR 00000602: < FAILED >
MSR 00000603: 0036-0000-0036-3636
MSR 00000604: < FAILED >
MSR 00000606: 0000-0000-000A-0E03
MSR 0000060A: 0000-0000-0000-0000
MSR 0000060B: 0000-0000-0000-0000
MSR 0000060C: 0000-0000-0000-0000
MSR 0000060D: 0000-01C1-179B-1F20
MSR 00000610: 0042-8198-00DD-80E0
MSR 00000611: 0000-0000-1429-47E2 [S200]
MSR 00000611: 0000-0000-1429-5F56 [S200]
MSR 00000611: 0000-0000-1429-7790
MSR 00000613: 0000-0000-0000-00AC
MSR 00000614: 0000-0000-0000-0078
MSR 00000618: 0054-00DE-0000-0000
MSR 00000619: 0000-0000-0000-0000 [S200]
MSR 00000619: 0000-0000-0000-0000 [S200]
MSR 00000619: 0000-0000-0000-0000
MSR 0000061B: 0000-0000-0000-0000
MSR 0000061C: < FAILED >
MSR 0000061E: < FAILED >
MSR 00000620: 0000-0000-0000-0424
MSR 00000621: 0000-0000-1605-000B
MSR 00000638: 0000-0000-0000-0000
MSR 00000639: 0000-0000-082B-848D [S200]
MSR 00000639: 0000-0000-082B-8BFB [S200]
MSR 00000639: 0000-0000-082B-927E
MSR 0000063A: 0000-0000-0000-0009
MSR 0000063B: < FAILED >
MSR 00000640: 0000-0000-0000-0000
MSR 00000641: 0000-0000-00F1-0DA9 [S200]
MSR 00000641: 0000-0000-00F1-0DAC [S200]
MSR 00000641: 0000-0000-00F1-0DAE
MSR 00000642: 0000-0000-0000-000D
MSR 00000648: 0000-0000-0000-000D
MSR 00000649: 0000-0000-000A-0060
MSR 0000064A: 0000-0000-000F-00C8
MSR 0000064B: 0000-0000-0000-0000
MSR 0000064C: 0000-0000-0000-000C
MSR 00000690: 0000-0000-0000-0000
MSR 000006B0: 0000-0000-0000-0000
MSR 000006B1: 0000-0000-0000-0000
MSR 00000770: 0000-0000-0000-0001
MSR 00000771: 0000-0000-010B-0D27
MSR 00000772: 0000-019E-5400-270D
MSR 00000773: 0000-0000-0000-0005
MSR 00000774: 0000-059E-5400-270D
MSR 00000777: 0000-0000-0000-0004
